{"schema_version":2,"fixture_class":"synthetic_live_event_stream_test_only","source_provenance":"synthetic_physical_ml_test_only","baseline_id":"synthetic-live-baseline","baseline_observed_at_ms":1000000,"device_identity":{"installation_id":"synthetic-installation","vacuum_id":"synthetic-vacuum","model_id":"synthetic_model","sku":"synthetic_sku","firmware":"synthetic_fw","integration_id":"integration.synthetic","integration_version":"synthetic_v2"},"initial_reservoirs":{"dock_clean":100,"dock_dirty":0,"robot_clean":20,"robot_dirty":0,"detergent":0},"setting_segments":[{"id":"s1","start_at_ms":1000000,"end_at_ms":1010000,"settings_id":"synthetic"}],"events":[{"id":"e1","sequence":1,"observed_at_ms":1000005,"segment_id":"s1","source_contract_id":"synthetic.physical_counter","quantity_provenance":"synthetic","completed":true,"aborted":false,"completion_evidence":"counter_increment","edges":[{"from":"robot_clean","to":"robot_dirty","amount_ml":5}]}],"expected_final_reservoirs":{"dock_clean":100,"dock_dirty":0,"robot_clean":15,"robot_dirty":5,"detergent":0}}
